[
  {
    "id": "cneos-fireball-api",
    "tipo": "api",
    "cita": "NASA/JPL Center for Near Earth Object Studies (CNEOS). Fireball Data API.",
    "url": "https://ssd-api.jpl.nasa.gov/doc/fireball.html",
    "licencia": "Datos del Gobierno de EE. UU.; la documentación no indica licencia explícita",
    "consultado": "2026-10-01",
    "metadatos_verificados": true,
    "notas": "vx, vy, vz se describen solo como 'Earth centered'. Peña-Asensio et al. 2025 los interpretan como ECEF; la diferencia frente a la hipótesis inercial no se puede resolver empíricamente (docs/reportes/chelyabinsk.md)."
  },
  {
    "id": "cneos-anuncio-2013",
    "tipo": "circular",
    "cita": "NASA/JPL Center for Near Earth Object Studies (CNEOS). Additional Details on the Large Fireball Event over Russia on Feb. 15, 2013 (1 de marzo de 2013).",
    "url": "https://cneos.jpl.nasa.gov/news/fireball_130301.html",
    "licencia": "Datos del Gobierno de EE. UU.; la página no indica licencia explícita",
    "consultado": "2026-10-12",
    "metadatos_verificados": true,
    "notas": "Primera publicación de los datos de los sensores para Chelyabinsk: pico de brillo a las 03:20:33 UT, 54,8° N 61,1° E, 23,3 km, 18,6 km/s, energía radiada 3,75 × 10¹⁴ J y energía de impacto total 440 kt. La API actual da la misma posición, altura y velocidad, pero las 03:20:26."
  },
  {
    "id": "astronomy-engine",
    "tipo": "software",
    "cita": "Cross, D. Astronomy Engine, v2.1.19.",
    "url": "https://github.com/cosinekitty/astronomy",
    "licencia": "MIT",
    "consultado": "2026-10-01",
    "metadatos_verificados": true
  },
  {
    "id": "pena-asensio-2025",
    "tipo": "articulo",
    "cita": "Peña-Asensio, E., Socas-Navarro, H., Seligman, D. Z. (2025). Error dependencies in the space-based CNEOS fireball database. Astronomy & Astrophysics, 701, A202.",
    "doi": "10.1051/0004-6361/202554224",
    "licencia": "Cita bibliográfica",
    "consultado": "2026-10-01",
    "metadatos_verificados": true,
    "notas": "Leída la versión arXiv:2508.01454v3 (HTML). Confirma que vx, vy, vz están en ECEF (sección 2.1). Tabla 4: errores medianos del grupo de bajo D_D (≥ 2018 o ≥ 0.45 kt): |ΔV| 0.55 km/s, Δα_g 1.35°, Δδ_g 0.84°. Tablas 2 y 3: 18 eventos calibrados (transcritos en data/calibracion/). Umbral D_D = 0.1 (Drummond 1981).",
    "url": "https://arxiv.org/abs/2508.01454"
  },
  {
    "id": "borovicka-2013-nature",
    "tipo": "articulo",
    "cita": "Borovička, J., Spurný, P., Brown, P., Wiegert, P., Kalenda, P., Clark, D., Shrbený, L. (2013). The trajectory, structure and origin of the Chelyabinsk asteroidal impactor. Nature, 503, 235–237.",
    "doi": "10.1038/nature12671",
    "licencia": "Cita bibliográfica",
    "consultado": "2026-10-07",
    "metadatos_verificados": true,
    "notas": "Leído el PDF completo del artículo (13 págs., incluidos Extended Data), aportado por el usuario el 2026-10-07; no se redistribuye. Tabla 2: órbita previa al impacto con incertidumbres «±» sin nivel declarado, osculadora 60 días antes del impacto (integración RADAU), equinoccio J2000.0. Nota de la Tabla 2: radiante geocéntrico α_g = 332,82 ± 0,11°, δ_g = +0,28 ± 0,14° (+0°17′ ± 8′; corregido el 2026-10-12, la extracción de texto había leído el signo «+» como un «1»), v_g = 15,14 ± 0,16 km/s. Tabla 1: trayectoria; el primer punto (64,477° E, 54,454° N, 95,0 km) coincide con el punto de trayectoria de Granvik & Brown 2018. Autores y DOI verificados en nature.com y en la página del coautor P. Wiegert.",
    "url": "https://www.nature.com/articles/nature12671"
  },
  {
    "id": "cbet-3423",
    "tipo": "circular",
    "cita": "Borovička, J., Spurný, P., Shrbený, L. (2013). Trajectory and orbit of the Chelyabinsk superbolide. CBET 3423.",
    "url": "https://tamkin3.eps.harvard.edu/cbet/003400/CBET003423.txt",
    "licencia": "Cita bibliográfica",
    "consultado": "2026-10-01",
    "metadatos_verificados": false,
    "notas": "Resultados preliminares. Autores por confirmar leyendo la circular."
  },
  {
    "id": "devillepoix-2019",
    "tipo": "articulo",
    "cita": "Devillepoix, H. A. R., Bland, P. A., Sansom, E. K. et al. (2019). Observation of metre-scale impactors by the Desert Fireball Network. Monthly Notices of the Royal Astronomical Society, 483, 5166–5178.",
    "licencia": "Cita bibliográfica",
    "consultado": "2026-10-01",
    "metadatos_verificados": true,
    "notas": "Metadatos verificados en Crossref y coincidentes con la cita de Peña-Asensio et al. 2025. Artículo no leído: las cifras que se le atribuyen (desviaciones de hasta 28 % en velocidad y ~90° en radiante) provienen de Peña-Asensio et al. 2025.",
    "doi": "10.1093/mnras/sty3442"
  },
  {
    "id": "popova-2013-science",
    "tipo": "articulo",
    "cita": "Popova, O. P. et al. (2013). Chelyabinsk Airburst, Damage Assessment, Meteorite Recovery, and Characterization. Science, 342, 1069–1073.",
    "doi": "10.1126/science.1242642",
    "url": "https://push-zb.helmholtz-munich.de/deliver.php?id=4308",
    "licencia": "Cita bibliográfica; copia de repositorio institucional para uso personal",
    "consultado": "2026-10-01",
    "metadatos_verificados": true,
    "notas": "Leída la copia completa del artículo (6 págs.). Tabla 1: trayectoria y órbita con incertidumbres a 2σ, equinoccio J2000.0. Páginas verificadas en Crossref. La sección sobre el origen cita el modelo de procedencia de Bottke et al. como «Icarus 156, 339–433 (2000)»; según Crossref ese artículo es Icarus 156, 399–433 (2002), doi:10.1006/icar.2001.6788 (errata en la cita de la fuente). Material suplementario (157 págs.) leído el 2026-10-12 en la copia de https://www.meteorites.ru/menu/publication/popova_ea_2013_science.pdf (no se redistribuye): Tabla S1 (hora, posición, altura y velocidad de los episodios del bólido; pág. 3) y sección 1.1, «Model of Meteoroid Orbital Dynamics» (pág. 20), con las cinco probabilidades del modelo de Bottke et al."
  },
  {
    "id": "bottke-2002",
    "tipo": "articulo",
    "cita": "Bottke, W. F., Morbidelli, A., Jedicke, R., Petit, J.-M., Levison, H. F., Michel, P., Metcalfe, T. S. (2002). Debiased Orbital and Absolute Magnitude Distribution of the Near-Earth Objects. Icarus, 156, 399–433.",
    "doi": "10.1006/icar.2001.6788",
    "licencia": "Cita bibliográfica",
    "consultado": "2026-10-12",
    "metadatos_verificados": true,
    "notas": "Modelo de procedencia que aplican Popova et al. 2013 (su ref. 33, citada allí con año 2000 y páginas 339–433, ambos erróneos). Título, revista, volumen, páginas, año y primer autor verificados en Crossref el 2026-10-12; Crossref no lista a los coautores, que se toman de la lista de referencias de Popova et al. No se usa ningún dato de este artículo: solo se nombra el modelo."
  },
  {
    "id": "brown-2002",
    "tipo": "articulo",
    "cita": "Brown, P., Spalding, R. E., ReVelle, D. O., Tagliaferri, E., Worden, S. P. (2002). The flux of small near-Earth objects colliding with the Earth. Nature, 420, 294–296.",
    "doi": "10.1038/nature01238",
    "licencia": "Cita bibliográfica",
    "consultado": "2026-10-12",
    "metadatos_verificados": true,
    "notas": "Metadatos verificados en Crossref el 2026-10-12. La página de introducción del CNEOS (https://cneos.jpl.nasa.gov/fireballs/intro.html, consultada el 2026-10-12) indica que la energía de impacto total (impact-e) se estima a partir de la energía óptica radiada con la expresión empírica de este artículo, E = 8,2508 · E₀^0,885 (kt). Con los 89,6 kt radiados de Chelyabinsk da 441 kt, el valor del registro."
  },
  {
    "id": "emelyanenko-2014-arxiv",
    "tipo": "articulo",
    "cita": "Emel'yanenko, V. V., Naroenkov, S. A., Jenniskens, P., Popova, O. P. (2014). The Orbit and Dynamical Evolution of the Chelyabinsk Object. Preprint arXiv:1412.1987 (enviado a Meteoritics & Planetary Science).",
    "url": "https://arxiv.org/abs/1412.1987",
    "licencia": "Licencia de distribución de arXiv",
    "consultado": "2026-10-01",
    "metadatos_verificados": true,
    "notas": "Leído el preprint. Tabla 1: elementos pre-atmosféricos, equinoccio J2000, época 2013-02-15.0 TT; incertidumbres formales de mínimos cuadrados sin nivel declarado. No se verificó la versión publicada."
  },
  {
    "id": "metbull",
    "tipo": "base-de-datos",
    "cita": "Meteoritical Society. Meteoritical Bulletin Database.",
    "url": "https://www.lpi.usra.edu/meteor/",
    "licencia": "Por verificar",
    "consultado": "2026-10-01",
    "metadatos_verificados": false,
    "notas": "El 2026-10-01 el sitio respondió con una verificación anti-bots que no se intentó eludir; registro no leído."
  },
  {
    "id": "nasa-blue-marble",
    "tipo": "textura",
    "cita": "NASA Earth Observatory. Blue Marble: Next Generation, topografía y batimetría, diciembre de 2004 (world.topo.bathy.200412.3x5400x2700.jpg).",
    "url": "https://science.nasa.gov/earth/earth-observatory/blue-marble-next-generation/base-topography-bathymetry",
    "licencia": "Contenido de NASA: en general no sujeto a copyright en EE. UU.; uso educativo e informativo (incluidas páginas web) permitido reconociendo a NASA como fuente",
    "consultado": "2026-10-01",
    "metadatos_verificados": false,
    "notas": "Licencia según las NASA Images and Media Usage Guidelines (https://www.nasa.gov/nasa-brand-center/images-and-media/, consultado 2026-10-05); la página de la imagen no declara licencia ni línea de crédito propias. Reescalada a 4096×2048 (escritorio), 2048×1024 (móvil) y 1024×512 (carga inicial), WebP, en public/texturas/."
  },
  {
    "id": "nasa-planetary-fact-sheet",
    "tipo": "base-de-datos",
    "cita": "Williams, D. R. NASA Planetary Fact Sheet (NSSDCA).",
    "url": "https://nssdc.gsfc.nasa.gov/planetary/factsheet/",
    "licencia": "Dato del Gobierno de EE. UU.",
    "consultado": "2026-10-01",
    "metadatos_verificados": true,